{
  "$schema": "https://json-schema.org/draft/2020-12/schema",
  "$id": "https://ms-ghostman.local/schemas/map.schema.json",
  "title": "Ms. Ghostman Level Map",
  "description": "Schema for validating Ms. Ghostman level map JSON files. Each map defines a 2D grid of cells, spawn points, and level metadata.",
  "type": "object",
  "required": ["level", "metadata", "dimensions", "grid", "spawn"],
  "additionalProperties": false,
  "properties": {
    "$schema": {
      "type": "string",
      "pattern": "^\\.\\./docs/schemas/map\\.schema\\.json$"
    },
    "level": {
      "type": "integer",
      "minimum": 1,
      "maximum": 3,
      "description": "The level number (1-3)."
    },
    "metadata": {
      "type": "object",
      "required": ["name", "timerSeconds", "maxGhosts", "ghostSpeed", "activeGhostTypes"],
      "additionalProperties": false,
      "properties": {
        "name": {
          "type": "string",
          "minLength": 1,
          "maxLength": 100,
          "description": "Human-readable level name."
        },
        "timerSeconds": {
          "type": "integer",
          "minimum": 1,
          "maximum": 600,
          "description": "Countdown timer for this level in seconds."
        },
        "maxGhosts": {
          "type": "integer",
          "minimum": 1,
          "maximum": 4,
          "description": "Maximum number of ghosts active on this level."
        },
        "ghostSpeed": {
          "type": "number",
          "minimum": 1.0,
          "maximum": 10.0,
          "description": "Ghost normal movement speed in tiles per second."
        },
        "activeGhostTypes": {
          "type": "array",
          "minItems": 1,
          "maxItems": 4,
          "uniqueItems": true,
          "description": "Ghost type IDs that spawn on this level (0=Blinky, 1=Pinky, 2=Inky, 3=Clyde).",
          "items": {
            "type": "integer",
            "minimum": 0,
            "maximum": 3
          }
        }
      }
    },
    "dimensions": {
      "type": "object",
      "required": ["columns", "rows"],
      "additionalProperties": false,
      "properties": {
        "columns": {
          "type": "integer",
          "minimum": 10,
          "maximum": 100,
          "description": "Number of columns (width) in the grid."
        },
        "rows": {
          "type": "integer",
          "minimum": 10,
          "maximum": 100,
          "description": "Number of rows (height) in the grid."
        }
      }
    },
    "grid": {
      "type": "array",
      "minItems": 1,
      "description": "2D array of cell type IDs. Each inner array represents one row.",
      "items": {
        "type": "array",
        "minItems": 10,
        "maxItems": 100,
        "items": {
          "type": "integer",
          "enum": [0, 1, 2, 3, 4, 5, 6],
          "description": "0=EMPTY, 1=INDESTRUCTIBLE, 2=DESTRUCTIBLE, 3=PELLET, 4=POWER_PELLET, 5=GHOST_HOUSE, 6=PLAYER_START"
        }
      }
    },
    "spawn": {
      "type": "object",
      "required": ["player", "ghostHouse", "ghostSpawnPoint"],
      "additionalProperties": false,
      "properties": {
        "player": {
          "type": "object",
          "required": ["row", "col"],
          "additionalProperties": false,
          "properties": {
            "row": {
              "type": "integer",
              "minimum": 0,
              "description": "Player spawn row (0-indexed)."
            },
            "col": {
              "type": "integer",
              "minimum": 0,
              "description": "Player spawn column (0-indexed)."
            }
          }
        },
        "ghostHouse": {
          "type": "object",
          "required": ["topRow", "bottomRow", "leftCol", "rightCol"],
          "additionalProperties": false,
          "properties": {
            "topRow": {
              "type": "integer",
              "minimum": 0,
              "description": "Top row of the ghost house bounding box."
            },
            "bottomRow": {
              "type": "integer",
              "minimum": 0,
              "description": "Bottom row of the ghost house bounding box (inclusive)."
            },
            "leftCol": {
              "type": "integer",
              "minimum": 0,
              "description": "Left column of the ghost house bounding box."
            },
            "rightCol": {
              "type": "integer",
              "minimum": 0,
              "description": "Right column of the ghost house bounding box (inclusive)."
            }
          }
        },
        "ghostSpawnPoint": {
          "type": "object",
          "required": ["row", "col"],
          "additionalProperties": false,
          "properties": {
            "row": {
              "type": "integer",
              "minimum": 0,
              "description": "Ghost spawn row (0-indexed)."
            },
            "col": {
              "type": "integer",
              "minimum": 0,
              "description": "Ghost spawn column (0-indexed)."
            }
          }
        }
      }
    },
    "asciiBlueprint": {
      "type": "array",
      "minItems": 1,
      "description": "Optional: original ASCII blueprint for reference. Each string is one row.",
      "items": {
        "type": "string",
        "minLength": 1
      }
    }
  }
}
