{
  "$schema": "../docs/schemas/map.schema.json",
  "level": 1,
  "metadata": {
    "name": "Level 1",
    "timerSeconds": 120,
    "maxGhosts": 2,
    "ghostSpeed": 4.0,
    "activeGhostTypes": [0, 1]
  },
  "dimensions": {
    "columns": 15,
    "rows": 11
  },
  "grid": [
    [1, 1, 1, 1, 1, 1, 1, 1, 1, 1, 1, 1, 1, 1, 1],
    [1, 4, 3, 3, 3, 3, 2, 3, 3, 3, 1, 3, 3, 4, 1],
    [1, 3, 1, 1, 1, 3, 1, 1, 1, 3, 1, 3, 1, 3, 1],
    [1, 3, 2, 3, 3, 3, 3, 3, 3, 3, 2, 3, 1, 3, 1],
    [1, 1, 1, 3, 1, 3, 5, 5, 5, 3, 1, 3, 1, 1, 1],
    [1, 3, 3, 3, 1, 3, 5, 5, 5, 3, 1, 3, 3, 3, 1],
    [1, 1, 1, 3, 1, 3, 1, 1, 1, 3, 1, 3, 1, 1, 1],
    [1, 3, 2, 3, 3, 3, 3, 6, 3, 3, 3, 3, 1, 3, 1],
    [1, 3, 1, 1, 1, 3, 1, 1, 1, 3, 1, 1, 1, 3, 1],
    [1, 4, 2, 3, 3, 3, 3, 3, 3, 2, 3, 3, 3, 4, 1],
    [1, 1, 1, 1, 1, 1, 1, 1, 1, 1, 1, 1, 1, 1, 1]
  ],
  "spawn": {
    "player": { "row": 7, "col": 7 },
    "ghostHouse": {
      "topRow": 4,
      "bottomRow": 5,
      "leftCol": 6,
      "rightCol": 8
    },
    "ghostSpawnPoint": { "row": 4, "col": 7 }
  },
  "asciiBlueprint": [
    "###############",
    "#*....+...#..*#",
    "#.###.###.#.#.#",
    "#.+.......+.#.#",
    "###.#.GGG.#.###",
    "#...#.GGG.#...#",
    "###.#.###.#.###",
    "#.+....@....#.#",
    "#.###.###.###.#",
    "#*+......+...*#",
    "###############"
  ]
}
